,county,ward,Muni,ReportingUnit,mapped,PARTIALFIPS,EXPANDEDGEO
899,Fond Du Lac,Town Of Lamartine Wards 1-2,Town Of Lamartine,Wards 1-2,"Wards 1,2",5503942125,55039421250001|55039421250002
900,Fond Du Lac,Town Of Marshfield Wards 1-2,Town Of Marshfield,Wards 1-2,"Wards 1,2",5503949650,55039496500001|55039496500002
901,Fond Du Lac,Town Of Metomen Wards 1-2,Town Of Metomen,Wards 1-2,"Wards 1,2",5503951450,55039514500001|55039514500002
902,Fond Du Lac,Town Of Oakfield Wards 1-2,Town Of Oakfield,Wards 1-2,"Wards 1,2",5503958925,55039589250001|55039589250002
903,Fond Du Lac,Town Of Osceola Wards 1-2,Town Of Osceola,Wards 1-2,"Wards 1,2",5503960425,55039604250001|55039604250002
904,Fond Du Lac,Town Of Ripon Wards 1-2,Town Of Ripon,Wards 1-2,"Wards 1,2",5503968200,55039682000001|55039682000002
905,Fond Du Lac,Town Of Rosendale Ward 1,Town Of Rosendale,Ward 1,Ward 1,5503969550,55039695500001
906,Fond Du Lac,Town Of Springvale Ward 1,Town Of Springvale,Ward 1,Ward 1,5503976250,55039762500001
907,Fond Du Lac,Town Of Taycheedah Wards 1-5,Town Of Taycheedah,Wards 1-5,"Wards 1,2,3,4,5",5503979125,55039791250001|55039791250002|55039791250003|55039791250004|55039791250005
908,Fond Du Lac,Town Of Waupun Wards 1-2,Town Of Waupun,Wards 1-2,"Wards 1,2",5503984450,55039844500001|55039844500002
909,Fond Du Lac,Village Of Brandon Ward 1,Village Of Brandon,Ward 1,Ward 1,5503909300,55039093000001
910,Fond Du Lac,Village Of Campbellsport Wards 1-4,Village Of Campbellsport,Wards 1-4,"Wards 1,2,3,4",5503912325,55039123250001|55039123250002|55039123250003|55039123250004
911,Fond Du Lac,Village Of Eden Ward 1,Village Of Eden,Ward 1,Ward 1,5503922475,55039224750001
912,Fond Du Lac,Village Of Fairwater Ward 1,Village Of Fairwater,Ward 1,Ward 1,5503925075,55039250750001
913,Fond Du Lac,Village Of Kewaskum Wd 6,Village Of Kewaskum,Wd 6,Ward 6,5503939300,55039393000006
914,Fond Du Lac,Village Of Mount Calvary Ward 1,Village Of Mount Calvary,Ward 1,Ward 1,5503954650,55039546500001
915,Fond Du Lac,Village Of North Fond Du Lac Wards 1-7,Village Of North Fond Du Lac,Wards 1-7,"Wards 1,2,3,4,5,6,7",5503958000,55039580000001|55039580000002|55039580000003|55039580000004|55039580000005|55039580000006|55039580000007
916,Fond Du Lac,Village Of Oakfield Wards 1-2,Village Of Oakfield,Wards 1-2,"Wards 1,2",5503958900,55039589000001|55039589000002
917,Fond Du Lac,Village Of Rosendale Wards 1-2,Village Of Rosendale,Wards 1-2,"Wards 1,2",5503969525,55039695250001|55039695250002
918,Fond Du Lac,Village Of St. Cloud Ward 1,Village Of St. Cloud,Ward 1,Ward 1,5503970500,55039705000001
919,Fond Du Lac,City Of Fond Du Lac Ward 1,City Of Fond Du Lac,Ward 1,Ward 1,5503926275,55039262750001
920,Fond Du Lac,City Of Fond Du Lac Ward 2,City Of Fond Du Lac,Ward 2,Ward 2,5503926275,55039262750002
921,Fond Du Lac,City Of Fond Du Lac Ward 3,City Of Fond Du Lac,Ward 3,Ward 3,5503926275,55039262750003
922,Fond Du Lac,City Of Fond Du Lac Ward 4,City Of Fond Du Lac,Ward 4,Ward 4,5503926275,55039262750004
923,Fond Du Lac,City Of Fond Du Lac Ward 5,City Of Fond Du Lac,Ward 5,Ward 5,5503926275,55039262750005
924,Fond Du Lac,City Of Fond Du Lac Ward 6,City Of Fond Du Lac,Ward 6,Ward 6,5503926275,55039262750006
925,Fond Du Lac,City Of Fond Du Lac Ward 7,City Of Fond Du Lac,Ward 7,Ward 7,5503926275,55039262750007
926,Fond Du Lac,City Of Fond Du Lac Ward 8,City Of Fond Du Lac,Ward 8,Ward 8,5503926275,55039262750008
927,Fond Du Lac,City Of Fond Du Lac Ward 9,City Of Fond Du Lac,Ward 9,Ward 9,5503926275,55039262750009
928,Fond Du Lac,City Of Fond Du Lac Ward 10,City Of Fond Du Lac,Ward 10,Ward 10,5503926275,55039262750010
929,Fond Du Lac,City Of Fond Du Lac Ward 11,City Of Fond Du Lac,Ward 11,Ward 11,5503926275,55039262750011
930,Fond Du Lac,City Of Fond Du Lac Ward 12,City Of Fond Du Lac,Ward 12,Ward 12,5503926275,55039262750012
931,Fond Du Lac,City Of Fond Du Lac Ward 13,City Of Fond Du Lac,Ward 13,Ward 13,5503926275,55039262750013
932,Fond Du Lac,City Of Fond Du Lac Ward 14,City Of Fond Du Lac,Ward 14,Ward 14,5503926275,55039262750014
933,Fond Du Lac,City Of Fond Du Lac Ward 15,City Of Fond Du Lac,Ward 15,Ward 15,5503926275,55039262750015
934,Fond Du Lac,City Of Fond Du Lac Ward 16,City Of Fond Du Lac,Ward 16,Ward 16,5503926275,55039262750016
935,Fond Du Lac,City Of Fond Du Lac Ward 17,City Of Fond Du Lac,Ward 17,Ward 17,5503926275,55039262750017
936,Fond Du Lac,City Of Fond Du Lac Ward 18,City Of Fond Du Lac,Ward 18,Ward 18,5503926275,55039262750018
937,Fond Du Lac,City Of Fond Du Lac Ward 19,City Of Fond Du Lac,Ward 19,Ward 19,5503926275,55039262750019
938,Fond Du Lac,City Of Fond Du Lac Ward 20,City Of Fond Du Lac,Ward 20,Ward 20,5503926275,55039262750020
939,Fond Du Lac,City Of Fond Du Lac Ward 21,City Of Fond Du Lac,Ward 21,Ward 21,5503926275,55039262750021
940,Fond Du Lac,City Of Fond Du Lac Ward 22,City Of Fond Du Lac,Ward 22,Ward 22,5503926275,55039262750022
941,Fond Du Lac,City Of Fond Du Lac Ward 23,City Of Fond Du Lac,Ward 23,Ward 23,5503926275,55039262750023
942,Fond Du Lac,City Of Fond Du Lac Ward 24,City Of Fond Du Lac,Ward 24,Ward 24,5503926275,55039262750024
943,Fond Du Lac,City Of Fond Du Lac Ward 25,City Of Fond Du Lac,Ward 25,Ward 25,5503926275,55039262750025
944,Fond Du Lac,City Of Fond Du Lac Ward 26,City Of Fond Du Lac,Ward 26,Ward 26,5503926275,55039262750026
945,Fond Du Lac,City Of Fond Du Lac Ward 27,City Of Fond Du Lac,Ward 27,Ward 27,5503926275,55039262750027
946,Fond Du Lac,City Of Ripon Wards 1-3,City Of Ripon,Wards 1-3,"Wards 1,2,3",5503968175,55039681750001|55039681750002|55039681750003
947,Fond Du Lac,City Of Ripon Wards 4-6,City Of Ripon,Wards 4-6,"Wards 4,5,6",5503968175,55039681750004|55039681750005|55039681750006
948,Fond Du Lac,City Of Ripon Wards 7-8,City Of Ripon,Wards 7-8,"Wards 7,8",5503968175,55039681750007|55039681750008
949,Fond Du Lac,City Of Ripon Wards 9-11,City Of Ripon,Wards 9-11,"Wards 9,10,11",5503968175,55039681750009|55039681750010|55039681750011
950,Fond Du Lac,City Of Waupun Wards 9B,City Of Waupun,Wards 9B,Wards 9B,5503984425,5503984425009B
951,Fond Du Lac,"City Of Waupun Wards 9, 9A, 10, 11 ,12",City Of Waupun,"Wards 9, 9A, 10, 11 ,12","Wards 9,9A,10,11,12",5503984425,55039844250009|5503984425009A|55039844250010|55039844250011|55039844250012
952,Forest,Town Of Alvin Ward 1,Town Of Alvin,Ward 1,Ward 1,5504101625,55041016250001
953,Forest,"Town Of Argonne Wards 1, 2, 3",Town Of Argonne,"Wards 1, 2, 3","Wards 1,2,3",5504102625,55041026250001|55041026250002|55041026250003
954,Forest,Town Of Armstrong Creek Ward 1,Town Of Armstrong Creek,Ward 1,Ward 1,5504102950,55041029500001
955,Forest,Town Of Blackwell Ward 1,Town Of Blackwell,Ward 1,Ward 1,5504107950,55041079500001
956,Forest,Town Of Caswell Ward 1,Town Of Caswell,Ward 1,Ward 1,5504113125,55041131250001
957,Forest,"Town Of Crandon Wards 1, 2, 3",Town Of Crandon,"Wards 1, 2, 3","Wards 1,2,3",5504117450,55041174500001|55041174500002|55041174500003
958,Forest,Town Of Freedom Ward 1,Town Of Freedom,Ward 1,Ward 1,5504127600,55041276000001
959,Forest,Town Of Hiles Ward 1,Town Of Hiles,Ward 1,Ward 1,5504134650,55041346500001
960,Forest,Town Of Laona Wards 1-3,Town Of Laona,Wards 1-3,"Wards 1,2,3",5504142500,55041425000001|55041425000002|55041425000003
961,Forest,"Town Of Lincoln Wards 1, 2, 3",Town Of Lincoln,"Wards 1, 2, 3","Wards 1,2,3",5504144375,55041443750001|55041443750002|55041443750003
962,Forest,Town Of Nashville Ward 1,Town Of Nashville,Ward 1,Ward 1,5504155575,55041555750001
963,Forest,Town Of Nashville Ward 2,Town Of Nashville,Ward 2,Ward 2,5504155575,55041555750002
964,Forest,Town Of Nashville Ward 3,Town Of Nashville,Ward 3,Ward 3,5504155575,55041555750003
965,Forest,Town Of Popple River Ward 1,Town Of Popple River,Ward 1,Ward 1,5504164050,55041640500001
966,Forest,Town Of Ross Ward 1,Town Of Ross,Ward 1,Ward 1,5504169625,55041696250001
967,Forest,"Town Of Wabeno Wards 1, 2, 3, 4, 5",Town Of Wabeno,"Wards 1, 2, 3, 4, 5","Wards 1,2,3,4,5",5504183025,55041830250001|55041830250002|55041830250003|55041830250004|55041830250005
968,Forest,City Of Crandon Wards 1 - 4,City Of Crandon,Wards 1 - 4,"Wards 1,2,3,4",5504117425,55041174250001|55041174250002|55041174250003|55041174250004
969,Grant,Town Of Beetown Ward 1,Town Of Beetown,Ward 1,Ward 1,5504306100,55043061000001
970,Grant,Town Of Bloomington Ward 1,Town Of Bloomington,Ward 1,Ward 1,5504308400,55043084000001
971,Grant,Town Of Boscobel Wards 1 & 2,Town Of Boscobel,Wards 1 & 2,"Wards 1,2",5504308875,55043088750001|55043088750002
972,Grant,Town Of Cassville Ward 1,Town Of Cassville,Ward 1,Ward 1,5504313075,55043130750001
973,Grant,Town Of Castle Rock Ward 1,Town Of Castle Rock,Ward 1,Ward 1,5504313100,55043131000001
974,Grant,Town Of Clifton Wards 1 & 2,Town Of Clifton,Wards 1 & 2,"Wards 1,2",5504315500,55043155000001|55043155000002
975,Grant,Town Of Ellenboro Ward 1,Town Of Ellenboro,Ward 1,Ward 1,5504323400,55043234000001
976,Grant,Town Of Fennimore Wards 1 & 2,Town Of Fennimore,Wards 1 & 2,"Wards 1,2",5504325625,55043256250001|55043256250002
977,Grant,Town Of Glen Haven Ward 1,Town Of Glen Haven,Ward 1,Ward 1,5504329525,55043295250001
978,Grant,Town Of Harrison Ward 1,Town Of Harrison,Ward 1,Ward 1,5504332825,55043328250001
979,Grant,Town Of Hazel Green Wards 1 - 2,Town Of Hazel Green,Wards 1 - 2,"Wards 1,2",5504333525,55043335250001|55043335250002
980,Grant,Town Of Hickory Grove Ward 1,Town Of Hickory Grove,Ward 1,Ward 1,5504334300,55043343000001
981,Grant,"Town Of Jamestown Wards 1, 2 & 3",Town Of Jamestown,"Wards 1, 2 & 3","Wards 1,2,3",5504337800,55043378000001|55043378000002|55043378000003
982,Grant,Town Of Liberty Ward 1,Town Of Liberty,Ward 1,Ward 1,5504343825,55043438250001
983,Grant,Town Of Lima Ward 1,Town Of Lima,Ward 1,Ward 1,5504344050,55043440500001
984,Grant,Town Of Little Grant Ward 1,Town Of Little Grant,Ward 1,Ward 1,5504345025,55043450250001
985,Grant,Town Of Marion Ward 1,Town Of Marion,Ward 1,Ward 1,5504349350,55043493500001
986,Grant,Town Of Millville Ward 1,Town Of Millville,Ward 1,Ward 1,5504352150,55043521500001
987,Grant,Town Of Mount Hope Ward 1,Town Of Mount Hope,Ward 1,Ward 1,5504354700,55043547000001
988,Grant,Town Of Mount Ida Ward 1,Town Of Mount Ida,Ward 1,Ward 1,5504354775,55043547750001
989,Grant,Town Of Muscoda Ward 1,Town Of Muscoda,Ward 1,Ward 1,5504355225,55043552250001
990,Grant,Town Of North Lancaster Wards 1 & 2,Town Of North Lancaster,Wards 1 & 2,"Wards 1,2",5504358125,55043581250001|55043581250002
991,Grant,Town Of Paris Wards 1-2,Town Of Paris,Wards 1-2,"Wards 1,2",5504361150,55043611500001|55043611500002
992,Grant,Town Of Patch Grove Ward 1,Town Of Patch Grove,Ward 1,Ward 1,5504361450,55043614500001
993,Grant,"Town Of Platteville Wards 1, 2 & 3",Town Of Platteville,"Wards 1, 2 & 3","Wards 1,2,3",5504363275,55043632750001|55043632750002|55043632750003
994,Grant,Town Of Potosi Ward 1,Town Of Potosi,Ward 1,Ward 1,5504364650,55043646500001
995,Grant,Town Of Smelser Wards 1 & 2,Town Of Smelser,Wards 1 & 2,"Wards 1,2",5504374450,55043744500001|55043744500002
996,Grant,"Town Of South Lancaster Wards 1, 2 & 3",Town Of South Lancaster,"Wards 1, 2 & 3","Wards 1,2,3",5504375075,55043750750001|55043750750002|55043750750003
997,Grant,Town Of Waterloo Ward 1,Town Of Waterloo,Ward 1,Ward 1,5504383900,55043839000001
998,Grant,Town Of Watterstown Ward 1 & 2,Town Of Watterstown,Ward 1 & 2,"Wards 1,2",5504384075,55043840750001|55043840750002
999,Grant,Town Of Wingville Ward 1,Town Of Wingville,Ward 1,Ward 1,5504387800,55043878000001
1000,Grant,Town Of Woodman Ward 1,Town Of Woodman,Ward 1,Ward 1,5504388850,55043888500001
1001,Grant,Town Of Wyalusing Ward 1,Town Of Wyalusing,Ward 1,Ward 1,5504389250,55043892500001
1002,Grant,Village Of Bagley Ward 1,Village Of Bagley,Ward 1,Ward 1,5504304250,55043042500001
1003,Grant,Village Of Bloomington Ward 1,Village Of Bloomington,Ward 1,Ward 1,5504308375,55043083750001
1004,Grant,Village Of Blue River Ward 1,Village Of Blue River,Ward 1,Ward 1,5504308525,55043085250001
1005,Grant,Village Of Cassville Wards 1 & 2,Village Of Cassville,Wards 1 & 2,"Wards 1,2",5504313050,55043130500001|55043130500002
1006,Grant,Village Of Dickeyville Wards 1-2,Village Of Dickeyville,Wards 1-2,"Wards 1,2",5504320175,55043201750001|55043201750002
1007,Grant,Village Of Hazel Green Ward 1 & 2,Village Of Hazel Green,Ward 1 & 2,"Wards 1,2",5504333500,55043335000001|55043335000002
1008,Grant,Village Of Livingston Ward 1,Village Of Livingston,Ward 1,Ward 1,5504345325,55043453250001
1009,Grant,Village Of Montfort Ward 1,Village Of Montfort,Ward 1,Ward 1,5504353950,55043539500001
1010,Grant,Village Of Mount Hope Ward 1,Village Of Mount Hope,Ward 1,Ward 1,5504354675,55043546750001
1011,Grant,Village Of Muscoda Wards 1-2,Village Of Muscoda,Wards 1-2,"Wards 1,2",5504355200,55043552000001|55043552000002
1012,Grant,Village Of Patch Grove Ward 1,Village Of Patch Grove,Ward 1,Ward 1,5504361425,55043614250001
1013,Grant,Village Of Potosi Ward 1,Village Of Potosi,Ward 1,Ward 1,5504364625,55043646250001
1014,Grant,Village Of Tennyson Ward 1,Village Of Tennyson,Ward 1,Ward 1,5504379250,55043792500001
1015,Grant,Village Of Woodman Ward 1,Village Of Woodman,Ward 1,Ward 1,5504388825,55043888250001
1016,Grant,City Of Boscobel Wards 1 - 4,City Of Boscobel,Wards 1 - 4,"Wards 1,2,3,4",5504308850,55043088500001|55043088500002|55043088500003|55043088500004
1017,Grant,City Of Cuba City Wards 1 - 4,City Of Cuba City,Wards 1 - 4,"Wards 1,2,3,4",5504317950,55043179500001|55043179500002|55043179500003|55043179500004
1018,Grant,City Of Fennimore Ward 1-4,City Of Fennimore,Ward 1-4,"Wards 1,2,3,4",5504325600,55043256000001|55043256000002|55043256000003|55043256000004
1019,Grant,City Of Lancaster Wards 1 - 6,City Of Lancaster,Wards 1 - 6,"Wards 1,2,3,4,5,6",5504342250,55043422500001|55043422500002|55043422500003|55043422500004|55043422500005|55043422500006
1020,Grant,City Of Platteville Wards 1-2,City Of Platteville,Wards 1-2,"Wards 1,2",5504363250,55043632500001|55043632500002
1021,Grant,City Of Platteville Wards 3-4,City Of Platteville,Wards 3-4,"Wards 3,4",5504363250,55043632500003|55043632500004
1022,Grant,City Of Platteville Wards 5-6,City Of Platteville,Wards 5-6,"Wards 5,6",5504363250,55043632500005|55043632500006
1023,Grant,City Of Platteville Wards 7-8,City Of Platteville,Wards 7-8,"Wards 7,8",5504363250,55043632500007|55043632500008
1024,Green,Town Of Adams Ward 1,Town Of Adams,Ward 1,Ward 1,5504500325,55045003250001
1025,Green,Town Of Albany Wards 1 & 2,Town Of Albany,Wards 1 & 2,"Wards 1,2",5504500775,55045007750001|55045007750002
1026,Green,Town Of Brooklyn Wards 1-2-3,Town Of Brooklyn,Wards 1-2-3,"Wards 1,2,3",5504510100,55045101000001|55045101000002|55045101000003
1027,Green,Town Of Cadiz Ward 1,Town Of Cadiz,Ward 1,Ward 1,5504511725,55045117250001
1028,Green,Town Of Clarno Wards 1 & 2,Town Of Clarno,Wards 1 & 2,"Wards 1,2",5504515000,55045150000001|55045150000002
1029,Green,Town Of Decatur Wards 1-2-3,Town Of Decatur,Wards 1-2-3,"Wards 1,2,3",5504519075,55045190750001|55045190750002|55045190750003
1030,Green,Town Of Exeter Wards 1-2-3-4,Town Of Exeter,Wards 1-2-3-4,"Wards 1,2,3,4",5504524725,55045247250001|55045247250002|55045247250003|55045247250004
1031,Green,Town Of Jefferson Wards 1 & 2,Town Of Jefferson,Wards 1 & 2,"Wards 1,2",5504537875,55045378750001|55045378750002
1032,Green,Town Of Jordan Ward 1,Town Of Jordan,Ward 1,Ward 1,5504538550,55045385500001
1033,Green,Town Of Monroe Wards 1 & 2,Town Of Monroe,Wards 1 & 2,"Wards 1,2",5504553775,55045537750001|55045537750002
1034,Green,Town Of Mount Pleasant Ward 1,Town Of Mount Pleasant,Ward 1,Ward 1,5504554850,55045548500001
1035,Green,Town Of Mount Pleasant Wards 2-3,Town Of Mount Pleasant,Wards 2-3,"Wards 2,3",5504554850,55045548500002|55045548500003
1036,Green,Town Of New Glarus Wards 1-2,Town Of New Glarus,Wards 1-2,"Wards 1,2",5504556725,55045567250001|55045567250002
1037,Green,Town Of Spring Grove Ward 1,Town Of Spring Grove,Ward 1,Ward 1,5504576075,55045760750001
1038,Green,Town Of Sylvester Wards 1 & 2,Town Of Sylvester,Wards 1 & 2,"Wards 1,2",5504578875,55045788750001|55045788750002
1039,Green,Town Of Washington Ward 1,Town Of Washington,Ward 1,Ward 1,5504583625,55045836250001
1040,Green,Town Of York Ward 1,Town Of York,Ward 1,Ward 1,5504589475,55045894750001
1041,Green,Village Of Albany Wards 1 & 2,Village Of Albany,Wards 1 & 2,"Wards 1,2",5504500750,55045007500001|55045007500002
1042,Green,Village Of Belleville Ward 3,Village Of Belleville,Ward 3,Ward 3,5504506300,55045063000003
1043,Green,Village Of Brooklyn Ward 2,Village Of Brooklyn,Ward 2,Ward 2,5504510075,55045100750002
1044,Green,Village Of Browntown Ward 1,Village Of Browntown,Ward 1,Ward 1,5504510475,55045104750001
1045,Green,Village Of Monticello Wards 1 & 2,Village Of Monticello,Wards 1 & 2,"Wards 1,2",5504554000,55045540000001|55045540000002
1046,Green,Village Of New Glarus Wards 1-2-3-4,Village Of New Glarus,Wards 1-2-3-4,"Wards 1,2,3,4",5504556700,55045567000001|55045567000002|55045567000003|55045567000004
1047,Green,City Of Brodhead Wards 1 - 6,City Of Brodhead,Wards 1 - 6,"Wards 1,2,3,4,5,6",5504509925,55045099250001|55045099250002|55045099250003|55045099250004|55045099250005|55045099250006
1048,Green,City Of Monroe Wards 1 - 9,City Of Monroe,Wards 1 - 9,"Wards 1,2,3,4,5,6,7,8,9",5504553750,55045537500001|55045537500002|55045537500003|55045537500004|55045537500005|55045537500006|55045537500007|55045537500008|55045537500009
1049,Green Lake,Town Of Berlin Wards 1-3,Town Of Berlin,Wards 1-3,"Wards 1,2,3",5504706950,55047069500001|55047069500002|55047069500003
1050,Green Lake,Town Of Brooklyn Wards 1 - 3,Town Of Brooklyn,Wards 1 - 3,"Wards 1,2,3",5504710125,55047101250001|55047101250002|55047101250003
1051,Green Lake,Town Of Green Lake Wards 1-2,Town Of Green Lake,Wards 1-2,"Wards 1,2",5504731350,55047313500001|55047313500002
1052,Green Lake,Town Of Kingston Wards 1 - 2,Town Of Kingston,Wards 1 - 2,"Wards 1,2",5504739775,55047397750001|55047397750002
1053,Green Lake,Town Of Mackford Ward 1,Town Of Mackford,Ward 1,Ward 1,5504746875,55047468750001
1054,Green Lake,Town Of Manchester Ward 1,Town Of Manchester,Ward 1,Ward 1,5504748400,55047484000001
1055,Green Lake,Town Of Marquette Ward 1,Town Of Marquette,Ward 1,Ward 1,5504749525,55047495250001
1056,Green Lake,Town Of Princeton Wards 1 - 4,Town Of Princeton,Wards 1 - 4,"Wards 1,2,3,4",5504765625,55047656250001|55047656250002|55047656250003|55047656250004
1057,Green Lake,Town Of St. Marie Wards 1 - 2,Town Of St. Marie,Wards 1 - 2,"Wards 1,2",5504770925,55047709250001|55047709250002
1058,Green Lake,Town Of Seneca Ward 1,Town Of Seneca,Ward 1,Ward 1,5504772525,55047725250001
1059,Green Lake,Village Of Kingston Ward 1,Village Of Kingston,Ward 1,Ward 1,5504739750,55047397500001
1060,Green Lake,Village Of Marquette Ward 1,Village Of Marquette,Ward 1,Ward 1,5504749500,55047495000001
1061,Green Lake,City Of Berlin Wards 1-6,City Of Berlin,Wards 1-6,"Wards 1,2,3,4,5,6",5504706925,55047069250001|55047069250002|55047069250003|55047069250004|55047069250005|55047069250006
1062,Green Lake,City Of Green Lake Wards 1 - 3,City Of Green Lake,Wards 1 - 3,"Wards 1,2,3",5504731300,55047313000001|55047313000002|55047313000003
1063,Green Lake,City Of Markesan Wards 1 - 3,City Of Markesan,Wards 1 - 3,"Wards 1,2,3",5504749450,55047494500001|55047494500002|55047494500003
1064,Green Lake,City Of Princeton Wards 1 - 4,City Of Princeton,Wards 1 - 4,"Wards 1,2,3,4",5504765600,55047656000001|55047656000002|55047656000003|55047656000004
1065,Iowa,Town Of Arena Wards 1-2,Town Of Arena,Wards 1-2,"Wards 1,2",5504902575,55049025750001|55049025750002
1066,Iowa,Town Of Brigham Wards 1-2,Town Of Brigham,Wards 1-2,"Wards 1,2",5504909600,55049096000001|55049096000002
1067,Iowa,Town Of Clyde Ward 1,Town Of Clyde,Ward 1,Ward 1,5504915875,55049158750001
1068,Iowa,Town Of Dodgeville Wards 1-4,Town Of Dodgeville,Wards 1-4,"Wards 1,2,3,4",5504920375,55049203750001|55049203750002|55049203750003|55049203750004
1069,Iowa,Town Of Eden Ward 1,Town Of Eden,Ward 1,Ward 1,5504922525,55049225250001
1070,Iowa,Town Of Highland Wards 1- 2,Town Of Highland,Wards 1- 2,"Wards 1,2",5504934475,55049344750001|55049344750002
1071,Iowa,Town Of Linden Wards 1-3,Town Of Linden,Wards 1-3,"Wards 1,2,3",5504944650,55049446500001|55049446500002|55049446500003
1072,Iowa,Town Of Mifflin Wards 1-2,Town Of Mifflin,Wards 1-2,"Wards 1,2",5504951725,55049517250001|55049517250002
1073,Iowa,Town Of Mineral Point Wards 1- 2,Town Of Mineral Point,Wards 1- 2,"Wards 1,2",5504953125,55049531250001|55049531250002
1074,Iowa,Town Of Moscow Wards 1-2,Town Of Moscow,Wards 1-2,"Wards 1,2",5504954425,55049544250001|55049544250002
1075,Iowa,Town Of Pulaski Ward 1,Town Of Pulaski,Ward 1,Ward 1,5504965700,55049657000001
1076,Iowa,Town Of Ridgeway Wards 1-2,Town Of Ridgeway,Wards 1-2,"Wards 1,2",5504967900,55049679000001|55049679000002
1077,Iowa,Town Of Waldwick Wards 1-2,Town Of Waldwick,Wards 1-2,"Wards 1,2",5504983150,55049831500001|55049831500002
1078,Iowa,Town Of Wyoming Wards 1-2,Town Of Wyoming,Wards 1-2,"Wards 1,2",5504989350,55049893500001|55049893500002
1079,Iowa,Village Of Arena Ward 1,Village Of Arena,Ward 1,Ward 1,5504902550,55049025500001
1080,Iowa,Village Of Avoca Ward 1,Village Of Avoca,Ward 1,Ward 1,5504904025,55049040250001
1081,Iowa,Village Of Barneveld Wards 1-2,Village Of Barneveld,Wards 1-2,"Wards 1,2",5504904775,55049047750001|55049047750002
1082,Iowa,Village Of Blanchardville Ward 2,Village Of Blanchardville,Ward 2,Ward 2,5504908125,55049081250002
1083,Iowa,Village Of Cobb Ward 1,Village Of Cobb,Ward 1,Ward 1,5504915975,55049159750001
1084,Iowa,Village Of Highland Ward 1,Village Of Highland,Ward 1,Ward 1,5504934450,55049344500001
1085,Iowa,Village Of Hollandale Ward 1,Village Of Hollandale,Ward 1,Ward 1,5504935400,55049354000001
1086,Iowa,Village Of Linden Ward 1,Village Of Linden,Ward 1,Ward 1,5504944625,55049446250001
1087,Iowa,Village Of Livingston Ward 2,Village Of Livingston,Ward 2,Ward 2,5504945325,55049453250002
1088,Iowa,Village Of Montfort Ward 2,Village Of Montfort,Ward 2,Ward 2,5504953950,55049539500002
1089,Iowa,Village Of Muscoda Ward 3,Village Of Muscoda,Ward 3,Ward 3,5504955200,55049552000003
1090,Iowa,Village Of Rewey Ward 1,Village Of Rewey,Ward 1,Ward 1,5504967100,55049671000001
1091,Iowa,Village Of Ridgeway Ward 1,Village Of Ridgeway,Ward 1,Ward 1,5504967875,55049678750001
1092,Iowa,City Of Dodgeville Wards 1 - 10,City Of Dodgeville,Wards 1 - 10,"Wards 1,2,3,4,5,6,7,8,9,10",5504920350,55049203500001|55049203500002|55049203500003|55049203500004|55049203500005|55049203500006|55049203500007|55049203500008|55049203500009|55049203500010
1093,Iowa,City Of Mineral Point Wards 1 - 6,City Of Mineral Point,Wards 1 - 6,"Wards 1,2,3,4,5,6",5504953100,55049531000001|55049531000002|55049531000003|55049531000004|55049531000005|55049531000006
1094,Iron,Town Of Anderson Ward 1,Town Of Anderson,Ward 1,Ward 1,5505101925,55051019250001
1095,Iron,Town Of Carey Ward 1,Town Of Carey,Ward 1,Ward 1,5505112525,55051125250001
1096,Iron,Town Of Gurney Ward 1,Town Of Gurney,Ward 1,Ward 1,5505131875,55051318750001
1097,Iron,Town Of Kimball Ward 1,Town Of Kimball,Ward 1,Ward 1,5505139625,55051396250001
1098,Iron,Town Of Knight Ward 1,Town Of Knight,Ward 1,Ward 1,5505140075,55051400750001
1099,Iron,Town Of Mercer Wards 1-4,Town Of Mercer,Wards 1-4,"Wards 1,2,3,4",5505151200,55051512000001|55051512000002|55051512000003|55051512000004
1100,Iron,Town Of Oma Ward 1,Town Of Oma,Ward 1,Ward 1,5505159850,55051598500001
1101,Iron,Town Of Pence Ward 1,Town Of Pence,Ward 1,Ward 1,5505161825,55051618250001
1102,Iron,Town Of Saxon Ward 1,Town Of Saxon,Ward 1,Ward 1,5505171875,55051718750001
1103,Iron,Town Of Sherman Ward 1,Town Of Sherman,Ward 1,Ward 1,5505173400,55051734000001
1104,Iron,City Of Hurley Ward 1,City Of Hurley,Ward 1,Ward 1,5505136525,55051365250001
1105,Iron,City Of Hurley Ward 2,City Of Hurley,Ward 2,Ward 2,5505136525,55051365250002
1106,Iron,City Of Hurley Ward 3,City Of Hurley,Ward 3,Ward 3,5505136525,55051365250003
1107,Iron,City Of Hurley Ward 4,City Of Hurley,Ward 4,Ward 4,5505136525,55051365250004
1108,Iron,City Of Montreal Wards 1-2,City Of Montreal,Wards 1-2,"Wards 1,2",5505154075,55051540750001|55051540750002
1109,Jackson,Town Of Adams Wards 1-3,Town Of Adams,Wards 1-3,"Wards 1,2,3",5505300350,55053003500001|55053003500002|55053003500003
1110,Jackson,Town Of Albion Wards 1-4,Town Of Albion,Wards 1-4,"Wards 1,2,3,4",5505300900,55053009000001|55053009000002|55053009000003|55053009000004
1111,Jackson,Town Of Alma Wards 1 & 4,Town Of Alma,Wards 1 & 4,"Wards 1,4",5505301275,55053012750001|55053012750004
1112,Jackson,"Town Of Alma Wards 2,3 & 5",Town Of Alma,"Wards 2,3 & 5","Wards 2,3,5",5505301275,55053012750002|55053012750003|55053012750005
1113,Jackson,Town Of Bear Bluff Ward 1,Town Of Bear Bluff,Ward 1,Ward 1,5505305550,55053055500001
1114,Jackson,Town Of Brockway Wards 1-6,Town Of Brockway,Wards 1-6,"Wards 1,2,3,4,5,6",5505309900,55053099000001|55053099000002|55053099000003|55053099000004|55053099000005|55053099000006
1115,Jackson,Town Of City Point Ward 1,Town Of City Point,Ward 1,Ward 1,5505314800,55053148000001
1116,Jackson,Town Of Cleveland Ward 1,Town Of Cleveland,Ward 1,Ward 1,5505315375,55053153750001
1117,Jackson,Town Of Curran Ward 1,Town Of Curran,Ward 1,Ward 1,5505318075,55053180750001
1118,Jackson,Town Of Franklin Ward 1,Town Of Franklin,Ward 1,Ward 1,5505327225,55053272250001
1119,Jackson,Town Of Garden Valley Ward 1,Town Of Garden Valley,Ward 1,Ward 1,5505328250,55053282500001
1120,Jackson,Town Of Garfield Ward 1,Town Of Garfield,Ward 1,Ward 1,5505328325,55053283250001
1121,Jackson,Town Of Hixton Wards 1 & 2,Town Of Hixton,Wards 1 & 2,"Wards 1,2",5505335100,55053351000001|55053351000002
1122,Jackson,Town Of Irving Wards 1-3,Town Of Irving,Wards 1-3,"Wards 1,2,3",5505337275,55053372750001|55053372750002|55053372750003
1123,Jackson,Town Of Knapp Ward 1,Town Of Knapp,Ward 1,Ward 1,5505340000,55053400000001
