,county,ward,Muni,ReportingUnit,mapped,PARTIALFIPS,EXPANDEDGEO
2712,Rock,City Of Beloit Ward 21,City Of Beloit,Ward 21,Ward 21,5510506500,55105065000021
2713,Rock,City Of Beloit Ward 22,City Of Beloit,Ward 22,Ward 22,5510506500,55105065000022
2714,Rock,City Of Beloit Ward 23,City Of Beloit,Ward 23,Ward 23,5510506500,55105065000023
2715,Rock,City Of Beloit Ward 24,City Of Beloit,Ward 24,Ward 24,5510506500,55105065000024
2716,Rock,City Of Beloit Ward 25,City Of Beloit,Ward 25,Ward 25,5510506500,55105065000025
2717,Rock,City Of Brodhead Wards 7 & 8,City Of Brodhead,Wards 7 & 8,"Wards 7,8",5510509925,55105099250007|55105099250008
2718,Rock,City Of Edgerton Wards 1 - 6,City Of Edgerton,Wards 1 - 6,"Wards 1,2,3,4,5,6",5510522575,55105225750001|55105225750002|55105225750003|55105225750004|55105225750005|55105225750006
2719,Rock,City Of Evansville Wards 1 - 9,City Of Evansville,Wards 1 - 9,"Wards 1,2,3,4,5,6,7,8,9",5510524550,55105245500001|55105245500002|55105245500003|55105245500004|55105245500005|55105245500006|55105245500007|55105245500008|55105245500009
2720,Rock,City Of Janesville Ward 1,City Of Janesville,Ward 1,Ward 1,5510537825,55105378250001
2721,Rock,City Of Janesville Ward 2,City Of Janesville,Ward 2,Ward 2,5510537825,55105378250002
2722,Rock,City Of Janesville Ward 3,City Of Janesville,Ward 3,Ward 3,5510537825,55105378250003
2723,Rock,City Of Janesville Ward 4,City Of Janesville,Ward 4,Ward 4,5510537825,55105378250004
2724,Rock,City Of Janesville Ward 5,City Of Janesville,Ward 5,Ward 5,5510537825,55105378250005
2725,Rock,City Of Janesville Ward 6,City Of Janesville,Ward 6,Ward 6,5510537825,55105378250006
2726,Rock,City Of Janesville Ward 7,City Of Janesville,Ward 7,Ward 7,5510537825,55105378250007
2727,Rock,City Of Janesville Ward 8,City Of Janesville,Ward 8,Ward 8,5510537825,55105378250008
2728,Rock,City Of Janesville Ward 9,City Of Janesville,Ward 9,Ward 9,5510537825,55105378250009
2729,Rock,City Of Janesville Ward 10,City Of Janesville,Ward 10,Ward 10,5510537825,55105378250010
2730,Rock,City Of Janesville Ward 11,City Of Janesville,Ward 11,Ward 11,5510537825,55105378250011
2731,Rock,City Of Janesville Ward 12,City Of Janesville,Ward 12,Ward 12,5510537825,55105378250012
2732,Rock,City Of Janesville Ward 13,City Of Janesville,Ward 13,Ward 13,5510537825,55105378250013
2733,Rock,City Of Janesville Ward 14,City Of Janesville,Ward 14,Ward 14,5510537825,55105378250014
2734,Rock,City Of Janesville Ward 15,City Of Janesville,Ward 15,Ward 15,5510537825,55105378250015
2735,Rock,City Of Janesville Ward 16,City Of Janesville,Ward 16,Ward 16,5510537825,55105378250016
2736,Rock,City Of Janesville Ward 17,City Of Janesville,Ward 17,Ward 17,5510537825,55105378250017
2737,Rock,City Of Janesville Ward 18,City Of Janesville,Ward 18,Ward 18,5510537825,55105378250018
2738,Rock,City Of Janesville Ward 19,City Of Janesville,Ward 19,Ward 19,5510537825,55105378250019
2739,Rock,City Of Janesville Ward 20,City Of Janesville,Ward 20,Ward 20,5510537825,55105378250020
2740,Rock,City Of Janesville Ward 21,City Of Janesville,Ward 21,Ward 21,5510537825,55105378250021
2741,Rock,City Of Janesville Ward 22,City Of Janesville,Ward 22,Ward 22,5510537825,55105378250022
2742,Rock,City Of Janesville Ward 23,City Of Janesville,Ward 23,Ward 23,5510537825,55105378250023
2743,Rock,City Of Janesville Ward 24,City Of Janesville,Ward 24,Ward 24,5510537825,55105378250024
2744,Rock,City Of Janesville Ward 25,City Of Janesville,Ward 25,Ward 25,5510537825,55105378250025
2745,Rock,City Of Janesville Ward 26,City Of Janesville,Ward 26,Ward 26,5510537825,55105378250026
2746,Rock,City Of Janesville Ward 27,City Of Janesville,Ward 27,Ward 27,5510537825,55105378250027
2747,Rock,City Of Janesville Ward 28,City Of Janesville,Ward 28,Ward 28,5510537825,55105378250028
2748,Rock,City Of Janesville Ward 29,City Of Janesville,Ward 29,Ward 29,5510537825,55105378250029
2749,Rock,City Of Janesville Ward 30,City Of Janesville,Ward 30,Ward 30,5510537825,55105378250030
2750,Rock,City Of Janesville Ward 31,City Of Janesville,Ward 31,Ward 31,5510537825,55105378250031
2751,Rock,City Of Milton Ward 1,City Of Milton,Ward 1,Ward 1,5510552200,55105522000001
2752,Rusk,Town Of Atlanta Wards 1-2,Town Of Atlanta,Wards 1-2,"Wards 1,2",5510703600,55107036000001|55107036000002
2753,Rusk,Town Of Big Bend Wards 1-2,Town Of Big Bend,Wards 1-2,"Wards 1,2",5510707175,55107071750001|55107071750002
2754,Rusk,Town Of Big Falls Wards 1,Town Of Big Falls,Wards 1,Ward 1,5510707225,55107072250001
2755,Rusk,Town Of Cedar Rapids Wards 1,Town Of Cedar Rapids,Wards 1,Ward 1,5510713550,55107135500001
2756,Rusk,Town Of Dewey Wards 1,Town Of Dewey,Wards 1,Ward 1,5510720000,55107200000001
2757,Rusk,Town Of Flambeau Wards 1-3,Town Of Flambeau,Wards 1-3,"Wards 1,2,3",5510726100,55107261000001|55107261000002|55107261000003
2758,Rusk,Town Of Grant Wards 1-5,Town Of Grant,Wards 1-5,"Wards 1,2,3,4,5",5510730375,55107303750001|55107303750002|55107303750003|55107303750004|55107303750005
2759,Rusk,Town Of Grow Ward 1,Town Of Grow,Ward 1,Ward 1,5510731775,55107317750001
2760,Rusk,Town Of Hawkins Ward 1,Town Of Hawkins,Ward 1,Ward 1,5510733300,55107333000001
2761,Rusk,Town Of Hubbard Ward 1,Town Of Hubbard,Ward 1,Ward 1,5510736125,55107361250001
2762,Rusk,Town Of Lawrence Wards 1-2,Town Of Lawrence,Wards 1-2,"Wards 1,2",5510742950,55107429500001|55107429500002
2763,Rusk,Town Of Marshall Wards 1-2,Town Of Marshall,Wards 1-2,"Wards 1,2",5510749625,55107496250001|55107496250002
2764,Rusk,Town Of Murry Ward 1,Town Of Murry,Ward 1,Ward 1,5510755175,55107551750001
2765,Rusk,Town Of Richland Wards 1-2,Town Of Richland,Wards 1-2,"Wards 1,2",5510767600,55107676000001|55107676000002
2766,Rusk,Town Of Rusk Ward 1,Town Of Rusk,Ward 1,Ward 1,5510770275,55107702750001
2767,Rusk,Town Of South Fork Ward 1,Town Of South Fork,Ward 1,Ward 1,5510774975,55107749750001
2768,Rusk,Town Of Strickland Wards 1-2,Town Of Strickland,Wards 1-2,"Wards 1,2",5510777775,55107777750001|55107777750002
2769,Rusk,Town Of Stubbs Wards 1-2,Town Of Stubbs,Wards 1-2,"Wards 1,2",5510777850,55107778500001|55107778500002
2770,Rusk,Town Of Thornapple Wards 1-5,Town Of Thornapple,Wards 1-5,"Wards 1,2,3,4,5",5510779575,55107795750001|55107795750002|55107795750003|55107795750004|55107795750005
2771,Rusk,Town Of True Wards 1,Town Of True,Wards 1,Ward 1,5510780950,55107809500001
2772,Rusk,Town Of Washington Ward 1,Town Of Washington,Ward 1,Ward 1,5510783675,55107836750001
2773,Rusk,Town Of Wilkinson Ward 1,Town Of Wilkinson,Ward 1,Ward 1,5510787125,55107871250001
2774,Rusk,Town Of Willard Ward 1,Town Of Willard,Ward 1,Ward 1,5510787175,55107871750001
2775,Rusk,Town Of Wilson Ward 1,Town Of Wilson,Ward 1,Ward 1,5510787450,55107874500001
2776,Rusk,Village Of Bruce Ward 1,Village Of Bruce,Ward 1,Ward 1,5510710500,55107105000001
2777,Rusk,Village Of Conrath Ward 1,Village Of Conrath,Ward 1,Ward 1,5510716775,55107167750001
2778,Rusk,Village Of Glen Flora Ward 1,Village Of Glen Flora,Ward 1,Ward 1,5510729475,55107294750001
2779,Rusk,Village Of Hawkins Ward 1,Village Of Hawkins,Ward 1,Ward 1,5510733275,55107332750001
2780,Rusk,Village Of Ingram Ward 1,Village Of Ingram,Ward 1,Ward 1,5510736925,55107369250001
2781,Rusk,Village Of Sheldon Ward 1,Village Of Sheldon,Ward 1,Ward 1,5510773175,55107731750001
2782,Rusk,Village Of Tony Ward 1,Village Of Tony,Ward 1,Ward 1,5510780225,55107802250001
2783,Rusk,Village Of Weyerhaeuser Ward 1-2,Village Of Weyerhaeuser,Ward 1-2,"Wards 1,2",5510786450,55107864500001|55107864500002
2784,Rusk,City Of Ladysmith Wards 1 - 15,City Of Ladysmith,Wards 1 - 15,"Wards 1,2,3,4,5,6,7,8,9,10,11,12,13,14,15",5510740850,55107408500001|55107408500002|55107408500003|55107408500004|55107408500005|55107408500006|55107408500007|55107408500008|55107408500009|55107408500010|55107408500011|55107408500012|55107408500013|55107408500014|55107408500015
2785,St. Croix,Town Of Baldwin Wards 1 - 2,Town Of Baldwin,Wards 1 - 2,"Wards 1,2",5510904425,55109044250001|55109044250002
2786,St. Croix,Town Of Cady Ward 1,Town Of Cady,Ward 1,Ward 1,5510911775,55109117750001
2787,St. Croix,Town Of Cylon Ward 1,Town Of Cylon,Ward 1,Ward 1,5510918300,55109183000001
2788,St. Croix,Town Of Eau Galle Wards 1 - 2,Town Of Eau Galle,Wards 1 - 2,"Wards 1,2",5510922400,55109224000001|55109224000002
2789,St. Croix,Town Of Emerald Ward 1,Town Of Emerald,Ward 1,Ward 1,5510923925,55109239250001
2790,St. Croix,Town Of Erin Prairie Ward 1,Town Of Erin Prairie,Ward 1,Ward 1,5510924275,55109242750001
2791,St. Croix,Town Of Forest Ward 1,Town Of Forest,Ward 1,Ward 1,5510926525,55109265250001
2792,St. Croix,Town Of Glenwood Ward 1,Town Of Glenwood,Ward 1,Ward 1,5510929600,55109296000001
2793,St. Croix,Town Of Hammond Wards 1 - 3,Town Of Hammond,Wards 1 - 3,"Wards 1,2,3",5510932350,55109323500001|55109323500002|55109323500003
2794,St. Croix,Town Of Hudson Wards 1-14,Town Of Hudson,Wards 1-14,"Wards 1,2,3,4,5,6,7,8,9,10,11,12,13,14",5510936275,55109362750001|55109362750002|55109362750003|55109362750004|55109362750005|55109362750006|55109362750007|55109362750008|55109362750009|55109362750010|55109362750011|55109362750012|55109362750013|55109362750014
2795,St. Croix,Town Of Kinnickinnic Wards 1 - 3,Town Of Kinnickinnic,Wards 1 - 3,"Wards 1,2,3",5510939825,55109398250001|55109398250002|55109398250003
2796,St. Croix,Town Of Pleasant Valley Ward 1,Town Of Pleasant Valley,Ward 1,Ward 1,5510963425,55109634250001
2797,St. Croix,"Town Of Richmond Wards 1, 2",Town Of Richmond,"Wards 1, 2","Wards 1,2",5510967650,55109676500001|55109676500002
2798,St. Croix,Town Of Richmond Wards 3-5,Town Of Richmond,Wards 3-5,"Wards 3,4,5",5510967650,55109676500003|55109676500004|55109676500005
2799,St. Croix,Town Of Rush River Ward 1,Town Of Rush River,Ward 1,Ward 1,5510970200,55109702000001
2800,St. Croix,Town Of St. Joseph Wards 1 - 6,Town Of St. Joseph,Wards 1 - 6,"Wards 1,2,3,4,5,6",5510970825,55109708250001|55109708250002|55109708250003|55109708250004|55109708250005|55109708250006
2801,St. Croix,Town Of Somerset Wards 1 - 6,Town Of Somerset,Wards 1 - 6,"Wards 1,2,3,4,5,6",5510974700,55109747000001|55109747000002|55109747000003|55109747000004|55109747000005|55109747000006
2802,St. Croix,Town Of Springfield Ward 1,Town Of Springfield,Ward 1,Ward 1,5510975950,55109759500001
2803,St. Croix,Town Of Stanton Ward 1,Town Of Stanton,Ward 1,Ward 1,5510976675,55109766750001
2804,St. Croix,Town Of Star Prairie Wards 1 - 6,Town Of Star Prairie,Wards 1 - 6,"Wards 1,2,3,4,5,6",5510976850,55109768500001|55109768500002|55109768500003|55109768500004|55109768500005|55109768500006
2805,St. Croix,Town Of Troy Wards 1 - 7,Town Of Troy,Wards 1 - 7,"Wards 1,2,3,4,5,6,7",5510980800,55109808000001|55109808000002|55109808000003|55109808000004|55109808000005|55109808000006|55109808000007
2806,St. Croix,Town Of Warren Wards 1 - 3,Town Of Warren,Wards 1 - 3,"Wards 1,2,3",5510983400,55109834000001|55109834000002|55109834000003
2807,St. Croix,Village Of Baldwin Wards 1 - 7,Village Of Baldwin,Wards 1 - 7,"Wards 1,2,3,4,5,6,7",5510904400,55109044000001|55109044000002|55109044000003|55109044000004|55109044000005|55109044000006|55109044000007
2808,St. Croix,Village Of Deer Park Ward 1,Village Of Deer Park,Ward 1,Ward 1,5510919325,55109193250001
2809,St. Croix,Village Of Hammond Ward 1-4,Village Of Hammond,Ward 1-4,"Wards 1,2,3,4",5510932325,55109323250001|55109323250002|55109323250003|55109323250004
2810,St. Croix,Village Of North Hudson Wards 1-6,Village Of North Hudson,Wards 1-6,"Wards 1,2,3,4,5,6",5510958050,55109580500001|55109580500002|55109580500003|55109580500004|55109580500005|55109580500006
2811,St. Croix,Village Of Roberts Wards 1-4,Village Of Roberts,Wards 1-4,"Wards 1,2,3,4",5510968475,55109684750001|55109684750002|55109684750003|55109684750004
2812,St. Croix,Village Of Somerset Wards 1-4,Village Of Somerset,Wards 1-4,"Wards 1,2,3,4",5510974675,55109746750001|55109746750002|55109746750003|55109746750004
2813,St. Croix,Village Of Star Prairie Ward 1,Village Of Star Prairie,Ward 1,Ward 1,5510976825,55109768250001
2814,St. Croix,Village Of Spring Valley Ward 3,Village Of Spring Valley,Ward 3,Ward 3,5510976300,55109763000003
2815,St. Croix,Village Of Wilson Ward 1,Village Of Wilson,Ward 1,Ward 1,5510987475,55109874750001
2816,St. Croix,Village Of Woodville Ward 1-2,Village Of Woodville,Ward 1-2,"Wards 1,2",5510989025,55109890250001|55109890250002
2817,St. Croix,City Of Glenwood City Wards 1 - 2,City Of Glenwood City,Wards 1 - 2,"Wards 1,2",5510929625,55109296250001|55109296250002
2818,St. Croix,City Of Hudson Wards 1 - 2,City Of Hudson,Wards 1 - 2,"Wards 1,2",5510936250,55109362500001|55109362500002
2819,St. Croix,City Of Hudson Wards 3 - 4,City Of Hudson,Wards 3 - 4,"Wards 3,4",5510936250,55109362500003|55109362500004
2820,St. Croix,City Of Hudson Wards 5 - 6,City Of Hudson,Wards 5 - 6,"Wards 5,6",5510936250,55109362500005|55109362500006
2821,St. Croix,City Of Hudson Wards 7 - 8,City Of Hudson,Wards 7 - 8,"Wards 7,8",5510936250,55109362500007|55109362500008
2822,St. Croix,City Of Hudson Wards 9 - 10,City Of Hudson,Wards 9 - 10,"Wards 9,10",5510936250,55109362500009|55109362500010
2823,St. Croix,City Of Hudson Wards 11 - 12,City Of Hudson,Wards 11 - 12,"Wards 11,12",5510936250,55109362500011|55109362500012
2824,St. Croix,City Of New Richmond Wards 1-6,City Of New Richmond,Wards 1-6,"Wards 1,2,3,4,5,6",5510957100,55109571000001|55109571000002|55109571000003|55109571000004|55109571000005|55109571000006
2825,St. Croix,City Of New Richmond Wards 7-12,City Of New Richmond,Wards 7-12,"Wards 7,8,9,10,11,12",5510957100,55109571000007|55109571000008|55109571000009|55109571000010|55109571000011|55109571000012
2826,St. Croix,City Of River Falls Wards 1 - 4 & 15,City Of River Falls,Wards 1 - 4 & 15,"Wards 1,2,3,4,15",5510968275,55109682750001|55109682750002|55109682750003|55109682750004|55109682750015
2827,Sauk,Town Of Baraboo Wards 1-4,Town Of Baraboo,Wards 1-4,"Wards 1,2,3,4",5511104650,55111046500001|55111046500002|55111046500003|55111046500004
2828,Sauk,Town Of Bear Creek Ward 1,Town Of Bear Creek,Ward 1,Ward 1,5511105600,55111056000001
2829,Sauk,Town Of Dellona Wards 1-2,Town Of Dellona,Wards 1-2,"Wards 1,2",5511119550,55111195500001|55111195500002
2830,Sauk,Town Of Delton Wards 1-4,Town Of Delton,Wards 1-4,"Wards 1,2,3,4",5511119675,55111196750001|55111196750002|55111196750003|55111196750004
2831,Sauk,Town Of Excelsior Wards 1-3,Town Of Excelsior,Wards 1-3,"Wards 1,2,3",5511124675,55111246750001|55111246750002|55111246750003
2832,Sauk,Town Of Fairfield Ward 1-2,Town Of Fairfield,Ward 1-2,"Wards 1,2",5511124900,55111249000001|55111249000002
2833,Sauk,Town Of Franklin Wards 1-3,Town Of Franklin,Wards 1-3,"Wards 1,2,3",5511127350,55111273500001|55111273500002|55111273500003
2834,Sauk,Town Of Freedom Wards 1-2,Town Of Freedom,Wards 1-2,"Wards 1,2",5511127675,55111276750001|55111276750002
2835,Sauk,Town Of Greenfield Ward 1,Town Of Greenfield,Ward 1,Ward 1,5511131250,55111312500001
2836,Sauk,Town Of Honey Creek Ward 1,Town Of Honey Creek,Ward 1,Ward 1,5511135625,55111356250001
2837,Sauk,Town Of Ironton Ward 1,Town Of Ironton,Ward 1,Ward 1,5511137250,55111372500001
2838,Sauk,Town Of La Valle Wards 1-3,Town Of La Valle,Wards 1-3,"Wards 1,2,3",5511142850,55111428500001|55111428500002|55111428500003
2839,Sauk,Town Of Merrimac Ward 1,Town Of Merrimac,Ward 1,Ward 1,5511151350,55111513500001
2840,Sauk,Town Of Prairie Du Sac Wards 1-2,Town Of Prairie Du Sac,Wards 1-2,"Wards 1,2",5511165125,55111651250001|55111651250002
2841,Sauk,Town Of Reedsburg Wards 1-3,Town Of Reedsburg,Wards 1-3,"Wards 1,2,3",5511166825,55111668250001|55111668250002|55111668250003
2842,Sauk,Town Of Spring Green Wards 1-4,Town Of Spring Green,Wards 1-4,"Wards 1,2,3,4",5511176050,55111760500001|55111760500002|55111760500003|55111760500004
2843,Sauk,Town Of Sumpter Wards 1-3,Town Of Sumpter,Wards 1-3,"Wards 1,2,3",5511178525,55111785250001|55111785250002|55111785250003
2844,Sauk,Town Of Troy Ward 1,Town Of Troy,Ward 1,Ward 1,5511180825,55111808250001
2845,Sauk,Town Of Washington Ward 1-2,Town Of Washington,Ward 1-2,"Wards 1,2",5511183700,55111837000001|55111837000002
2846,Sauk,Town Of Westfield Ward 1,Town Of Westfield,Ward 1,Ward 1,5511185625,55111856250001
2847,Sauk,Town Of Winfield Wards 1-2,Town Of Winfield,Wards 1-2,"Wards 1,2",5511187775,55111877750001|55111877750002
2848,Sauk,Town Of Woodland Ward 1,Town Of Woodland,Ward 1,Ward 1,5511188775,55111887750001
2849,Sauk,Village Of Cazenovia Ward 2,Village Of Cazenovia,Ward 2,Ward 2,5511113300,55111133000002
2850,Sauk,Village Of Ironton Ward 1,Village Of Ironton,Ward 1,Ward 1,5511137225,55111372250001
2851,Sauk,Village Of Lake Delton Wards 1-3,Village Of Lake Delton,Wards 1-3,"Wards 1,2,3",5511141300,55111413000001|55111413000002|55111413000003
2852,Sauk,Village Of Lavalle Ward 1,Village Of Lavalle,Ward 1,Ward 1,5511142825,55111428250001
2853,Sauk,Village Of Lime Ridge Ward 1,Village Of Lime Ridge,Ward 1,Ward 1,5511144225,55111442250001
2854,Sauk,Village Of Loganville Ward 1,Village Of Loganville,Ward 1,Ward 1,5511145400,55111454000001
2855,Sauk,Village Of Merrimac Ward 1,Village Of Merrimac,Ward 1,Ward 1,5511151325,55111513250001
2856,Sauk,Village Of North Freedom Ward 1,Village Of North Freedom,Ward 1,Ward 1,5511158025,55111580250001
2857,Sauk,Village Of Plain Ward 1,Village Of Plain,Ward 1,Ward 1,5511163125,55111631250001
2858,Sauk,Village Of Prairie Du Sac Wards 1 - 4,Village Of Prairie Du Sac,Wards 1 - 4,"Wards 1,2,3,4",5511165100,55111651000001|55111651000002|55111651000003|55111651000004
2859,Sauk,Village Of Rock Springs Ward 1,Village Of Rock Springs,Ward 1,Ward 1,5511168975,55111689750001
2860,Sauk,Village Of Sauk City Wards 1-5,Village Of Sauk City,Wards 1-5,"Wards 1,2,3,4,5",5511171650,55111716500001|55111716500002|55111716500003|55111716500004|55111716500005
2861,Sauk,Village Of Spring Green Wards 1-2,Village Of Spring Green,Wards 1-2,"Wards 1,2",5511176025,55111760250001|55111760250002
2862,Sauk,Village Of West Baraboo Wards 1 & 2,Village Of West Baraboo,Wards 1 & 2,"Wards 1,2",5511185325,55111853250001|55111853250002
2863,Sauk,City Of Baraboo Wards 1 - 14,City Of Baraboo,Wards 1 - 14,"Wards 1,2,3,4,5,6,7,8,9,10,11,12,13,14",5511104625,55111046250001|55111046250002|55111046250003|55111046250004|55111046250005|55111046250006|55111046250007|55111046250008|55111046250009|55111046250010|55111046250011|55111046250012|55111046250013|55111046250014
2864,Sauk,"City Of Reedsburg Ward 1-3, 13",City Of Reedsburg,"Ward 1-3, 13","Ward 1,2,3,13",5511166800,55111668000001|55111668000002|55111668000003|55111668000013
2865,Sauk,"City Of Reedsburg Ward 4, 6, 14",City Of Reedsburg,"Ward 4, 6, 14","Ward 4,6,14",5511166800,55111668000004|55111668000006|55111668000014
2866,Sauk,"City Of Reedsburg Ward 5, 7-9",City Of Reedsburg,"Ward 5, 7-9","Ward 5,7,8,9",5511166800,55111668000005|55111668000007|55111668000008|55111668000009
2867,Sauk,City Of Reedsburg Ward 10-12,City Of Reedsburg,Ward 10-12,"Wards 10,11,12",5511166800,55111668000010|55111668000011|55111668000012
2868,Sauk,City Of Wisconsin Dells Ward 4,City Of Wisconsin Dells,Ward 4,Ward 4,5511188150,55111881500004
2869,Sauk,"City Of Wisconsin Dells Wards 8, 10",City Of Wisconsin Dells,"Wards 8, 10","Wards 8,10",5511188150,55111881500008|55111881500010
2870,Sawyer,Town Of Bass Lake Wards 1-5,Town Of Bass Lake,Wards 1-5,"Wards 1,2,3,4,5",5511305200,55113052000001|55113052000002|55113052000003|55113052000004|55113052000005
2871,Sawyer,Town Of Couderay Ward 1,Town Of Couderay,Ward 1,Ward 1,5511317250,55113172500001
2872,Sawyer,Town Of Draper Ward 1,Town Of Draper,Ward 1,Ward 1,5511320825,55113208250001
2873,Sawyer,Town Of Edgewater Wards 1-2,Town Of Edgewater,Wards 1-2,"Wards 1,2",5511322625,55113226250001|55113226250002
2874,Sawyer,Town Of Hayward Wards 1-8,Town Of Hayward,Wards 1-8,"Wards 1,2,3,4,5,6,7,8",5511333475,55113334750001|55113334750002|55113334750003|55113334750004|55113334750005|55113334750006|55113334750007|55113334750008
2875,Sawyer,Town Of Hunter Ward 1,Town Of Hunter,Ward 1,Ward 1,5511336450,55113364500001
2876,Sawyer,Town Of Lenroot Wards 1-2,Town Of Lenroot,Wards 1-2,"Wards 1,2",5511343400,55113434000001|55113434000002
2877,Sawyer,Town Of Meadowbrook Ward 1,Town Of Meadowbrook,Ward 1,Ward 1,5511350300,55113503000001
2878,Sawyer,Town Of Meteor Ward 1,Town Of Meteor,Ward 1,Ward 1,5511351425,55113514250001
2879,Sawyer,Town Of Ojibwa Wards 1-2,Town Of Ojibwa,Wards 1-2,"Wards 1,2",5511359600,55113596000001|55113596000002
2880,Sawyer,Town Of Radisson Wards 1-2,Town Of Radisson,Wards 1-2,"Wards 1,2",5511366075,55113660750001|55113660750002
2881,Sawyer,Town Of Round Lake Wards1-2,Town Of Round Lake,Wards1-2,"Wards 1,2",5511369750,55113697500001|55113697500002
2882,Sawyer,Town Of Sand Lake Ward 1,Town Of Sand Lake,Ward 1,Ward 1,5511371500,55113715000001
2883,Sawyer,Town Of Spider Lake Ward 1,Town Of Spider Lake,Ward 1,Ward 1,5511375450,55113754500001
2884,Sawyer,Town Of Weirgor Ward 1,Town Of Weirgor,Ward 1,Ward 1,5511385100,55113851000001
2885,Sawyer,Town Of Winter Wards 1-2,Town Of Winter,Wards 1-2,"Wards 1,2",5511388000,55113880000001|55113880000002
2886,Sawyer,Village Of Couderay Ward 1,Village Of Couderay,Ward 1,Ward 1,5511317225,55113172250001
2887,Sawyer,Village Of Exeland Ward 1,Village Of Exeland,Ward 1,Ward 1,5511324700,55113247000001
2888,Sawyer,Village Of Radisson Ward 1,Village Of Radisson,Ward 1,Ward 1,5511366050,55113660500001
2889,Sawyer,Village Of Winter Ward 1,Village Of Winter,Ward 1,Ward 1,5511387975,55113879750001
2890,Sawyer,City Of Hayward Wards 1 - 6,City Of Hayward,Wards 1 - 6,"Wards 1,2,3,4,5,6",5511333450,55113334500001|55113334500002|55113334500003|55113334500004|55113334500005|55113334500006
2891,Shawano,Town Of Almon Ward 1,Town Of Almon,Ward 1,Ward 1,5511501375,55115013750001
2892,Shawano,Town Of Angelica Wards 1 - 3,Town Of Angelica,Wards 1 - 3,"Wards 1,2,3",5511501975,55115019750001|55115019750002|55115019750003
2893,Shawano,Town Of Aniwa Ward 1,Town Of Aniwa,Ward 1,Ward 1,5511502100,55115021000001
2894,Shawano,Town Of Bartelme Ward 1,Town Of Bartelme,Ward 1,Ward 1,5511505000,55115050000001
2895,Shawano,Town Of Belle Plaine Wards 1 - 3,Town Of Belle Plaine,Wards 1 - 3,"Wards 1,2,3",5511506275,55115062750001|55115062750002|55115062750003
2896,Shawano,Town Of Birnamwood Ward 1,Town Of Birnamwood,Ward 1,Ward 1,5511507625,55115076250001
2897,Shawano,Town Of Fairbanks Ward 1,Town Of Fairbanks,Ward 1,Ward 1,5511524775,55115247750001
2898,Shawano,Town Of Germania Wards 1- 2,Town Of Germania,Wards 1- 2,"Wards 1,2",5511528825,55115288250001|55115288250002
2899,Shawano,Town Of Grant Ward 1 - 2,Town Of Grant,Ward 1 - 2,"Wards 1,2",5511530400,55115304000001|55115304000002
2900,Shawano,Town Of Green Valley Ward 1 - 2,Town Of Green Valley,Ward 1 - 2,"Wards 1,2",5511531500,55115315000001|55115315000002
2901,Shawano,Town Of Hartland Ward 1,Town Of Hartland,Ward 1,Ward 1,5511533075,55115330750001
2902,Shawano,Town Of Herman Ward 1 - 2,Town Of Herman,Ward 1 - 2,"Wards 1,2",5511534025,55115340250001|55115340250002
2903,Shawano,Town Of Hutchins Ward 1,Town Of Hutchins,Ward 1,Ward 1,5511536700,55115367000001
2904,Shawano,Town Of Lessor Ward 1 - 2,Town Of Lessor,Ward 1 - 2,"Wards 1,2",5511543675,55115436750001|55115436750002
2905,Shawano,Town Of Maple Grove Ward 1,Town Of Maple Grove,Ward 1,Ward 1,5511548900,55115489000001
2906,Shawano,Town Of Morris Ward 1,Town Of Morris,Ward 1,Ward 1,5511554250,55115542500001
2907,Shawano,Town Of Navarino Ward 1,Town Of Navarino,Ward 1,Ward 1,5511555675,55115556750001
2908,Shawano,Town Of Pella Ward 1,Town Of Pella,Ward 1,Ward 1,5511561700,55115617000001
2909,Shawano,Town Of Red Springs Wards 1 - 2,Town Of Red Springs,Wards 1 - 2,"Wards 1,2",5511566750,55115667500001|55115667500002
2910,Shawano,Town Of Richmond Wards 1-3,Town Of Richmond,Wards 1-3,"Wards 1,2,3",5511567675,55115676750001|55115676750002|55115676750003
2911,Shawano,Town Of Seneca Ward 1,Town Of Seneca,Ward 1,Ward 1,5511572550,55115725500001
2912,Shawano,Town Of Washington Wards 1 - 3,Town Of Washington,Wards 1 - 3,"Wards 1,2,3",5511583725,55115837250001|55115837250002|55115837250003
2913,Shawano,Town Of Waukechon Wards 1 - 2,Town Of Waukechon,Wards 1 - 2,"Wards 1,2",5511584225,55115842250001|55115842250002
2914,Shawano,Town Of Wescott Wards 1-4,Town Of Wescott,Wards 1-4,"Wards 1,2,3,4",5511585275,55115852750001|55115852750002|55115852750003|55115852750004
2915,Shawano,Town Of Wittenberg Wards 1 - 2,Town Of Wittenberg,Wards 1 - 2,"Wards 1,2",5511588350,55115883500001|55115883500002
2916,Shawano,Village Of Aniwa Ward 1,Village Of Aniwa,Ward 1,Ward 1,5511502075,55115020750001
2917,Shawano,Village Of Birnamwood Ward 1,Village Of Birnamwood,Ward 1,Ward 1,5511507600,55115076000001
2918,Shawano,Village Of Bonduel Wards 1 - 2,Village Of Bonduel,Wards 1 - 2,"Wards 1,2",5511508725,55115087250001|55115087250002
2919,Shawano,Village Of Bowler Ward 1,Village Of Bowler,Ward 1,Ward 1,5511509025,55115090250001
2920,Shawano,Village Of Cecil Ward 1,Village Of Cecil,Ward 1,Ward 1,5511513325,55115133250001
2921,Shawano,Village Of Eland Ward 1,Village Of Eland,Ward 1,Ward 1,5511522975,55115229750001
2922,Shawano,Village Of Gresham Ward 1,Village Of Gresham,Ward 1,Ward 1,5511531675,55115316750001
2923,Shawano,Village Of Mattoon Ward 1,Village Of Mattoon,Ward 1,Ward 1,5511550000,55115500000001
2924,Shawano,Village Of Pulaski Wards 4 & 7,Village Of Pulaski,Wards 4 & 7,"Wards 4,7",5511565675,55115656750004|55115656750007
2925,Shawano,Village Of Tigerton Ward 1,Village Of Tigerton,Ward 1,Ward 1,5511579825,55115798250001
2926,Shawano,Village Of Wittenberg Wards 1 - 2,Village Of Wittenberg,Wards 1 - 2,"Wards 1,2",5511588325,55115883250001|55115883250002
2927,Shawano,City Of Marion Wards 4 - 6,City Of Marion,Wards 4 - 6,"Wards 4,5,6",5511549400,55115494000004|55115494000005|55115494000006
2928,Shawano,City Of Shawano Wards 1 & 2,City Of Shawano,Wards 1 & 2,"Wards 1,2",5511572925,55115729250001|55115729250002
